{
  "profile_view_schema": "actproof.profile_view.v1",
  "profile_view_type": "public_projection",
  "profile_view_semantics": "derived renderable view, not the canonical catalogue entry",
  "act_id": "op:eu.dora.ict_incident_notification_initial.v1",
  "assessment_id": null,
  "generated_from": "actproof-events public export layer",
  "canonical_object": {
    "kind": "actproof-events catalogue entry",
    "act_id": "op:eu.dora.ict_incident_notification_initial.v1",
    "catalogue_entry_hash": "sha256:11d7f8ed9b896f73a1e82bc17133626200758ecb3764f0f5e2bb66744cd5c337",
    "catalogue_entry_hash_basis": "sha256(raw catalogue entry JSON file bytes)"
  },
  "profile": {
    "display_name": "DORA major ICT-related incident initial notification (Article 19(4))",
    "claim_type": "ict_incident_notification_initial",
    "version": 2,
    "maturity": "candidate",
    "regulatory_citation": {
      "instrument": "Regulation (EU) 2022/2554",
      "article": "19(4)",
      "jurisdiction": "EU",
      "in_force_from": "2025-01-17"
    },
    "catalogue_entry_hash": "sha256:11d7f8ed9b896f73a1e82bc17133626200758ecb3764f0f5e2bb66744cd5c337",
    "catalogue_entry_hash_basis": "sha256(raw catalogue entry JSON file bytes)",
    "compatible_with_receipts": true,
    "boundary": "ActProof shows what a machine-readable profile claims and where it came from. It does not certify legal compliance and is not legal advice.",
    "boundary_id": "actproof.boundary.v1",
    "claim_flags": {
      "legal_advice": false,
      "legal_certification": false,
      "supervisory_approval": false,
      "compliance_determination": false
    },
    "non_claims": [
      "does_not_constitute_an_admission_of_liability_by_the_financial_entity",
      "does_not_imply_a_breach_of_contract_with_clients_or_counterparties",
      "does_not_replace_the_separate_notification_obligation_under_directive_eu_2022_2555_nis2",
      "does_not_replace_a_personal_data_breach_notification_under_regulation_eu_2016_679_gdpr_article_33",
      "does_not_constitute_the_final_legal_classification_of_the_incident",
      "does_not_predetermine_supervisory_findings_or_sanctions",
      "does_not_exhaust_the_intermediate_and_final_reporting_obligations_under_dora_article_19_4",
      "does_not_prove_the_notification_was_transmitted_to_or_received_by_the_competent_authority"
    ],
    "required_evidence_labels": [
      "classification_committee_record",
      "detection_system_log_excerpt"
    ],
    "interpretive_summary": {
      "direct": 5,
      "derived": 6,
      "interpretive": 4,
      "unscored": 12
    }
  },
  "source_basis": {
    "scope": "act",
    "instruments": [
      {
        "instrument": "Regulation (EU) 2022/2554 (Digital Operational Resilience Act)",
        "authority": "European Parliament and Council of the European Union",
        "provisions": [
          "Article 19"
        ],
        "celex": "32022R2554",
        "eli": "http://data.europa.eu/eli/reg/2022/2554/oj",
        "sha256": "sha256:85307f9e2a0409826dd0f54489645935816d16e929f0db4db3ef15badd11d38c"
      },
      {
        "instrument": "Commission Delegated Regulation (EU) 2025/301",
        "authority": "European Commission",
        "provisions": [
          "Article 1",
          "Article 2",
          "Article 5"
        ],
        "celex": "32025R0301",
        "eli": "http://data.europa.eu/eli/reg_del/2025/301/oj",
        "sha256": "sha256:47a209a9f73e228e85e1dad2934d917d5791629fc98add06fc6fda0acb872dbf"
      },
      {
        "instrument": "Commission Implementing Regulation (EU) 2025/302",
        "authority": "European Commission",
        "provisions": [
          "Annex I",
          "Annex II"
        ],
        "celex": "32025R0302",
        "eli": "http://data.europa.eu/eli/reg_impl/2025/302/oj",
        "sha256": "sha256:37ec431c7a11b8b30b39d1c1f0d95c39539d1c1e7236301ee3b06bb229ff009c"
      },
      {
        "instrument": "Commission Delegated Regulation (EU) 2024/1772",
        "authority": "European Commission",
        "provisions": [
          "Articles 1 to 8"
        ],
        "celex": "32024R1772",
        "eli": "http://data.europa.eu/eli/reg_del/2024/1772/oj",
        "sha256": "sha256:416fb104161f8b3eb0aae2601060ab869b1672cfa8452d20798800301538ceab"
      }
    ]
  },
  "evidence": {
    "required_evidence_labels": [
      "classification_committee_record",
      "detection_system_log_excerpt"
    ],
    "evidence_scope": "profile"
  },
  "coverage": {
    "field_counts": {
      "total": 27,
      "required": 15,
      "optional": 12
    },
    "field_source_basis": {
      "field_level": 0,
      "act_level_fallback": 27,
      "fallback_used": 27,
      "coverage_ratio": 0.0,
      "by_scope": {
        "act": 27
      }
    },
    "evidence_scope": {
      "field_level": 0,
      "profile_level": 27
    },
    "assessment": {
      "scored_fields": 15,
      "unscored_fields": 12,
      "coverage_ratio": 55.6,
      "by_interpretive_status": {
        "derived": 6,
        "direct": 5,
        "interpretive": 4,
        "unscored": 12
      },
      "by_mapping_type": {
        "direct": 5,
        "modelled": 2,
        "normalised": 3,
        "reconciled": 2,
        "transformed": 3,
        "unscored": 12
      }
    },
    "disclosure": {
      "tiered_fields": 22,
      "untiered_fields": 5,
      "coverage_ratio": 81.5,
      "by_tier": {
        "commitment": 9,
        "private": 6,
        "public": 7,
        "untiered": 5
      }
    }
  },
  "non_claims": [
    "does_not_constitute_an_admission_of_liability_by_the_financial_entity",
    "does_not_imply_a_breach_of_contract_with_clients_or_counterparties",
    "does_not_replace_the_separate_notification_obligation_under_directive_eu_2022_2555_nis2",
    "does_not_replace_a_personal_data_breach_notification_under_regulation_eu_2016_679_gdpr_article_33",
    "does_not_constitute_the_final_legal_classification_of_the_incident",
    "does_not_predetermine_supervisory_findings_or_sanctions",
    "does_not_exhaust_the_intermediate_and_final_reporting_obligations_under_dora_article_19_4",
    "does_not_prove_the_notification_was_transmitted_to_or_received_by_the_competent_authority"
  ],
  "boundary": {
    "boundary_id": "actproof.boundary.v1",
    "text": "ActProof shows what a machine-readable profile claims and where it came from. It does not certify legal compliance and is not legal advice."
  },
  "fields": [
    {
      "field_id": "entity_legal_identifier",
      "required": true,
      "type": "string",
      "disclosure_tier": "public",
      "interpretive_status": "direct",
      "mapping_type": "direct",
      "interpretive_load": 0,
      "rubric_id": "evidence_layer_complexity.v1",
      "interpretive": false,
      "rationale": "Direct. Stable institutional identifier (LEI).",
      "evidence_burden": 0,
      "evidence_labels": [
        "classification_committee_record",
        "detection_system_log_excerpt"
      ],
      "evidence_scope": "profile",
      "act_id": "op:eu.dora.ict_incident_notification_initial.v1",
      "regulatory_citation": {
        "instrument": "Regulation (EU) 2022/2554",
        "article": "19(4)",
        "jurisdiction": "EU"
      },
      "source_basis": [
        {
          "instrument": "Regulation (EU) 2022/2554 (Digital Operational Resilience Act)",
          "authority": "European Parliament and Council of the European Union",
          "provisions": [
            "Article 19"
          ],
          "celex": "32022R2554",
          "eli": "http://data.europa.eu/eli/reg/2022/2554/oj",
          "sha256": "sha256:85307f9e2a0409826dd0f54489645935816d16e929f0db4db3ef15badd11d38c"
        },
        {
          "instrument": "Commission Delegated Regulation (EU) 2025/301",
          "authority": "European Commission",
          "provisions": [
            "Article 1",
            "Article 2",
            "Article 5"
          ],
          "celex": "32025R0301",
          "eli": "http://data.europa.eu/eli/reg_del/2025/301/oj",
          "sha256": "sha256:47a209a9f73e228e85e1dad2934d917d5791629fc98add06fc6fda0acb872dbf"
        },
        {
          "instrument": "Commission Implementing Regulation (EU) 2025/302",
          "authority": "European Commission",
          "provisions": [
            "Annex I",
            "Annex II"
          ],
          "celex": "32025R0302",
          "eli": "http://data.europa.eu/eli/reg_impl/2025/302/oj",
          "sha256": "sha256:37ec431c7a11b8b30b39d1c1f0d95c39539d1c1e7236301ee3b06bb229ff009c"
        },
        {
          "instrument": "Commission Delegated Regulation (EU) 2024/1772",
          "authority": "European Commission",
          "provisions": [
            "Articles 1 to 8"
          ],
          "celex": "32024R1772",
          "eli": "http://data.europa.eu/eli/reg_del/2024/1772/oj",
          "sha256": "sha256:416fb104161f8b3eb0aae2601060ab869b1672cfa8452d20798800301538ceab"
        }
      ],
      "source_basis_scope": "act",
      "fallback_used": true,
      "non_claims": [
        "does_not_constitute_an_admission_of_liability_by_the_financial_entity",
        "does_not_imply_a_breach_of_contract_with_clients_or_counterparties",
        "does_not_replace_the_separate_notification_obligation_under_directive_eu_2022_2555_nis2",
        "does_not_replace_a_personal_data_breach_notification_under_regulation_eu_2016_679_gdpr_article_33",
        "does_not_constitute_the_final_legal_classification_of_the_incident",
        "does_not_predetermine_supervisory_findings_or_sanctions",
        "does_not_exhaust_the_intermediate_and_final_reporting_obligations_under_dora_article_19_4",
        "does_not_prove_the_notification_was_transmitted_to_or_received_by_the_competent_authority"
      ],
      "boundary": "ActProof shows what a machine-readable profile claims and where it came from. It does not certify legal compliance and is not legal advice.",
      "boundary_id": "actproof.boundary.v1"